{
  "$schema": "http://json-schema.org/draft-07/schema#",
  "$id": "https://github.com/Recon-Fuzz/recon-registry/schema/entry.schema.json",
  "title": "Recon registry entry",
  "description": "One self-contained deployable contract (a project harness or a standalone mock). Single contract only — a project is one self-contained Setup-style harness, never a multi-contract manifest.",
  "type": "object",
  "additionalProperties": false,
  "required": ["name", "description", "tags", "abi", "creationBytecode", "source", "solc", "compilerSettings"],
  "properties": {
    "name": {
      "type": "string",
      "pattern": "^[A-Za-z0-9_.-]+$",
      "description": "Unique entry name (also the file name and the deploy-by-name key)."
    },
    "description": { "type": "string", "description": "One-line summary of what it stands up / does." },
    "author": { "type": "string", "description": "Optional attribution, e.g. \"Jane Doe <jane@example.com>\" (name required, email optional)." },
    "tags": {
      "type": "array",
      "items": { "type": "string" },
      "description": "Discovery tags, e.g. erc4626, vault, lending, oracle, harness, mock."
    },
    "abi": {
      "type": "array",
      "description": "Standard Solidity ABI (JSON). Needed to encode constructor args and interact."
    },
    "creationBytecode": {
      "type": "string",
      "pattern": "^0x[0-9a-fA-F]*$",
      "description": "Linked creation (init) bytecode. Self-contained — embeds any `new`'d deps. Must be non-empty and fully library-linked (no __$ placeholders)."
    },
    "source": {
      "type": "string",
      "description": "Inlined Solidity source so humans and the LLM operator can see exactly what the contract does."
    },
    "solc": {
      "type": "string",
      "pattern": "^[0-9]+\\.[0-9]+\\.[0-9]+$",
      "description": "Exact solc version the bytecode was built with."
    },
    "compilerSettings": {
      "type": "object",
      "additionalProperties": false,
      "required": ["optimizer", "evmVersion", "viaIR", "metadata"],
      "description": "Code-generation settings required to reproduce creationBytecode.",
      "properties": {
        "optimizer": {
          "type": "object",
          "additionalProperties": false,
          "required": ["enabled", "runs"],
          "properties": {
            "enabled": { "type": "boolean" },
            "runs": { "type": "integer", "minimum": 0 }
          }
        },
        "evmVersion": { "type": "string", "minLength": 1 },
        "viaIR": { "type": "boolean" },
        "metadata": {
          "type": "object",
          "additionalProperties": false,
          "required": ["bytecodeHash"],
          "properties": {
            "bytecodeHash": { "enum": ["ipfs", "bzzr1", "none"] },
            "appendCBOR": { "type": "boolean" }
          }
        }
      }
    },
    "labels": {
      "type": "array",
      "items": { "type": "string" },
      "description": "Optional. ONLY the additional internal addresses the constructor explicitly rvm.registers, entry-name-prefixed (e.g. \"LendingMock.loanToken\"). Do NOT list the main contract — it is auto-registered under the entry name (getAddr(\"<EntryName>\")). A self-contained mock that registers nothing internally → []."
    }
  }
}
