{
 "name": "MockERC4626Tester",
 "description": "Behavioral mock of a misbehaving ERC4626 vault — configurable per-function reverts (throw/OOG/return-bomb/revert-bomb), yield manipulation (increase/decrease), unbacked share minting, and a settable decimals offset. Subjects an integrator to a vault that drifts and misbehaves.",
 "author": "kn0t <terabase7@gmail.com>",
 "tags": [
  "vault",
  "erc4626",
  "integration",
  "mock"
 ],
 "labels": [],
 "abi": [
  {
   "type": "constructor",
   "inputs": [
    {
     "name": "_asset",
     "type": "address",
     "internalType": "address"
    }
   ],
   "stateMutability": "nonpayable"
  },
  {
   "type": "function",
   "name": "allowance",
   "inputs": [
    {
     "name": "owner",
     "type": "address",
     "internalType": "address"
    },
    {
     "name": "spender",
     "type": "address",
     "internalType": "address"
    }
   ],
   "outputs": [
    {
     "name": "",
     "type": "uint256",
     "internalType": "uint256"
    }
   ],
   "stateMutability": "view"
  },
  {
   "type": "function",
   "name": "approve",
   "inputs": [
    {
     "name": "spender",
     "type": "address",
     "internalType": "address"
    },
    {
     "name": "value",
     "type": "uint256",
     "internalType": "uint256"
    }
   ],
   "outputs": [
    {
     "name": "",
     "type": "bool",
     "internalType": "bool"
    }
   ],
   "stateMutability": "nonpayable"
  },
  {
   "type": "function",
   "name": "asset",
   "inputs": [],
   "outputs": [
    {
     "name": "",
     "type": "address",
     "internalType": "address"
    }
   ],
   "stateMutability": "view"
  },
  {
   "type": "function",
   "name": "balanceOf",
   "inputs": [
    {
     "name": "account",
     "type": "address",
     "internalType": "address"
    }
   ],
   "outputs": [
    {
     "name": "",
     "type": "uint256",
     "internalType": "uint256"
    }
   ],
   "stateMutability": "view"
  },
  {
   "type": "function",
   "name": "convertToAssets",
   "inputs": [
    {
     "name": "shares",
     "type": "uint256",
     "internalType": "uint256"
    }
   ],
   "outputs": [
    {
     "name": "",
     "type": "uint256",
     "internalType": "uint256"
    }
   ],
   "stateMutability": "view"
  },
  {
   "type": "function",
   "name": "convertToShares",
   "inputs": [
    {
     "name": "assets",
     "type": "uint256",
     "internalType": "uint256"
    }
   ],
   "outputs": [
    {
     "name": "",
     "type": "uint256",
     "internalType": "uint256"
    }
   ],
   "stateMutability": "view"
  },
  {
   "type": "function",
   "name": "decimals",
   "inputs": [],
   "outputs": [
    {
     "name": "",
     "type": "uint8",
     "internalType": "uint8"
    }
   ],
   "stateMutability": "view"
  },
  {
   "type": "function",
   "name": "decimalsOffset",
   "inputs": [],
   "outputs": [
    {
     "name": "",
     "type": "uint8",
     "internalType": "uint8"
    }
   ],
   "stateMutability": "view"
  },
  {
   "type": "function",
   "name": "decreaseYield",
   "inputs": [
    {
     "name": "decreasePercentageFP4",
     "type": "uint256",
     "internalType": "uint256"
    }
   ],
   "outputs": [],
   "stateMutability": "nonpayable"
  },
  {
   "type": "function",
   "name": "deposit",
   "inputs": [
    {
     "name": "assets",
     "type": "uint256",
     "internalType": "uint256"
    },
    {
     "name": "receiver",
     "type": "address",
     "internalType": "address"
    }
   ],
   "outputs": [
    {
     "name": "",
     "type": "uint256",
     "internalType": "uint256"
    }
   ],
   "stateMutability": "nonpayable"
  },
  {
   "type": "function",
   "name": "increaseYield",
   "inputs": [
    {
     "name": "increasePercentageFP4",
     "type": "uint256",
     "internalType": "uint256"
    }
   ],
   "outputs": [],
   "stateMutability": "nonpayable"
  },
  {
   "type": "function",
   "name": "maxDeposit",
   "inputs": [
    {
     "name": "",
     "type": "address",
     "internalType": "address"
    }
   ],
   "outputs": [
    {
     "name": "",
     "type": "uint256",
     "internalType": "uint256"
    }
   ],
   "stateMutability": "view"
  },
  {
   "type": "function",
   "name": "maxMint",
   "inputs": [
    {
     "name": "",
     "type": "address",
     "internalType": "address"
    }
   ],
   "outputs": [
    {
     "name": "",
     "type": "uint256",
     "internalType": "uint256"
    }
   ],
   "stateMutability": "view"
  },
  {
   "type": "function",
   "name": "maxRedeem",
   "inputs": [
    {
     "name": "owner",
     "type": "address",
     "internalType": "address"
    }
   ],
   "outputs": [
    {
     "name": "",
     "type": "uint256",
     "internalType": "uint256"
    }
   ],
   "stateMutability": "view"
  },
  {
   "type": "function",
   "name": "maxWithdraw",
   "inputs": [
    {
     "name": "owner",
     "type": "address",
     "internalType": "address"
    }
   ],
   "outputs": [
    {
     "name": "",
     "type": "uint256",
     "internalType": "uint256"
    }
   ],
   "stateMutability": "view"
  },
  {
   "type": "function",
   "name": "mint",
   "inputs": [
    {
     "name": "shares",
     "type": "uint256",
     "internalType": "uint256"
    },
    {
     "name": "receiver",
     "type": "address",
     "internalType": "address"
    }
   ],
   "outputs": [
    {
     "name": "",
     "type": "uint256",
     "internalType": "uint256"
    }
   ],
   "stateMutability": "nonpayable"
  },
  {
   "type": "function",
   "name": "mintUnbackedShares",
   "inputs": [
    {
     "name": "amount",
     "type": "uint256",
     "internalType": "uint256"
    },
    {
     "name": "to",
     "type": "address",
     "internalType": "address"
    }
   ],
   "outputs": [],
   "stateMutability": "nonpayable"
  },
  {
   "type": "function",
   "name": "name",
   "inputs": [],
   "outputs": [
    {
     "name": "",
     "type": "string",
     "internalType": "string"
    }
   ],
   "stateMutability": "view"
  },
  {
   "type": "function",
   "name": "previewDeposit",
   "inputs": [
    {
     "name": "assets",
     "type": "uint256",
     "internalType": "uint256"
    }
   ],
   "outputs": [
    {
     "name": "",
     "type": "uint256",
     "internalType": "uint256"
    }
   ],
   "stateMutability": "view"
  },
  {
   "type": "function",
   "name": "previewMint",
   "inputs": [
    {
     "name": "shares",
     "type": "uint256",
     "internalType": "uint256"
    }
   ],
   "outputs": [
    {
     "name": "",
     "type": "uint256",
     "internalType": "uint256"
    }
   ],
   "stateMutability": "view"
  },
  {
   "type": "function",
   "name": "previewRedeem",
   "inputs": [
    {
     "name": "shares",
     "type": "uint256",
     "internalType": "uint256"
    }
   ],
   "outputs": [
    {
     "name": "",
     "type": "uint256",
     "internalType": "uint256"
    }
   ],
   "stateMutability": "view"
  },
  {
   "type": "function",
   "name": "previewWithdraw",
   "inputs": [
    {
     "name": "assets",
     "type": "uint256",
     "internalType": "uint256"
    }
   ],
   "outputs": [
    {
     "name": "",
     "type": "uint256",
     "internalType": "uint256"
    }
   ],
   "stateMutability": "view"
  },
  {
   "type": "function",
   "name": "redeem",
   "inputs": [
    {
     "name": "shares",
     "type": "uint256",
     "internalType": "uint256"
    },
    {
     "name": "receiver",
     "type": "address",
     "internalType": "address"
    },
    {
     "name": "owner",
     "type": "address",
     "internalType": "address"
    }
   ],
   "outputs": [
    {
     "name": "",
     "type": "uint256",
     "internalType": "uint256"
    }
   ],
   "stateMutability": "nonpayable"
  },
  {
   "type": "function",
   "name": "revertBehaviours",
   "inputs": [
    {
     "name": "",
     "type": "uint8",
     "internalType": "enum MockERC4626Tester.FunctionType"
    }
   ],
   "outputs": [
    {
     "name": "",
     "type": "uint8",
     "internalType": "enum MockERC4626Tester.RevertType"
    }
   ],
   "stateMutability": "view"
  },
  {
   "type": "function",
   "name": "setDecimalsOffset",
   "inputs": [
    {
     "name": "targetDecimalsOffset",
     "type": "uint8",
     "internalType": "uint8"
    }
   ],
   "outputs": [],
   "stateMutability": "nonpayable"
  },
  {
   "type": "function",
   "name": "setRevertBehaviour",
   "inputs": [
    {
     "name": "ft",
     "type": "uint8",
     "internalType": "enum MockERC4626Tester.FunctionType"
    },
    {
     "name": "rt",
     "type": "uint8",
     "internalType": "enum MockERC4626Tester.RevertType"
    }
   ],
   "outputs": [],
   "stateMutability": "nonpayable"
  },
  {
   "type": "function",
   "name": "symbol",
   "inputs": [],
   "outputs": [
    {
     "name": "",
     "type": "string",
     "internalType": "string"
    }
   ],
   "stateMutability": "view"
  },
  {
   "type": "function",
   "name": "totalAssets",
   "inputs": [],
   "outputs": [
    {
     "name": "",
     "type": "uint256",
     "internalType": "uint256"
    }
   ],
   "stateMutability": "view"
  },
  {
   "type": "function",
   "name": "totalSupply",
   "inputs": [],
   "outputs": [
    {
     "name": "",
     "type": "uint256",
     "internalType": "uint256"
    }
   ],
   "stateMutability": "view"
  },
  {
   "type": "function",
   "name": "transfer",
   "inputs": [
    {
     "name": "to",
     "type": "address",
     "internalType": "address"
    },
    {
     "name": "value",
     "type": "uint256",
     "internalType": "uint256"
    }
   ],
   "outputs": [
    {
     "name": "",
     "type": "bool",
     "internalType": "bool"
    }
   ],
   "stateMutability": "nonpayable"
  },
  {
   "type": "function",
   "name": "transferFrom",
   "inputs": [
    {
     "name": "from",
     "type": "address",
     "internalType": "address"
    },
    {
     "name": "to",
     "type": "address",
     "internalType": "address"
    },
    {
     "name": "value",
     "type": "uint256",
     "internalType": "uint256"
    }
   ],
   "outputs": [
    {
     "name": "",